{
  "title": "大企業より「小さな組織のトップ」を選んだ理由｜鶏口牛後の考え方",
  "slug": "startup-career-choice-keikougyugo",
  "category": "career",
  "excerpt": "大企業か、スタートアップか。就活で悩んでいませんか？大企業のインターンを経験しながら、あえてスタートアップを選んだエンジニア社長が語る「鶏口牛後」の考え方と、好きを仕事にする大切さとは。",
  "body": [
    {
      "type": "h2",
      "text": "学生時代は「大企業に行くもの」だと思っていた"
    },
    {
      "type": "p",
      "text": "学生の頃は、とにかく大企業に行くものだと思っていました。地方の大学出身で、周りも「とりあえず大企業に入って、みんなが知っている会社に入れれば安泰」という空気感がありました。親も大企業に入ると喜ぶし、スタートアップなんて言ったら「大丈夫？」と心配されるのが当たり前。インターンシップに行った時も、親は嬉しそうでしたね。"
    },
    {
      "type": "h2",
      "text": "大企業インターンで感じた違和感"
    },
    {
      "type": "p",
      "text": "大阪にある有名な大企業でインターンをさせていただきました。海外経験を活かしたい、仕事を通して海外に行きたいという想いがあったので、最初は大企業のメーカーで海外に行けそうなところしか見ていませんでした。"
    },
    {
      "type": "p",
      "text": "インターンの印象は、良くも悪くも「システマチック」でした。「海外に行かせてください」と調子に乗ってお話ししていたのですが、返ってきた答えは「行けるよ。でも、まず3年くらい下積みがあって、そこから早い人で4〜5年で行ける」というもの。「早くて4〜5年」という言葉に、自分の気持ちや勢いとのギャップを強く感じました。今思えば納得感はあるのですが、当時は「何年も待たなきゃいけないのか」と、大企業は違うのかもと思い始めたきっかけでしたね。"
    },
    {
      "type": "h2",
      "text": "「鶏口牛後」という考え方"
    },
    {
      "type": "p",
      "text": "スタートアップの社長をやってみて、本当に良かったと思っています。僕の好きな言葉に「鶏口牛後（けいこうぎゅうご）」があります。大きい組織の一部として後ろにいるよりも、小さい組織でもトップに立つという考え方です。"
    },
    {
      "type": "p",
      "text": "そこまでの責任を負ってやってみないと学べないことがたくさんあります。自分に力をつけるという意味では、小さくてもいいから、自分に何かしら権限や責任を持たせてもらえる状態に立つことがすごく重要だと考えています。自分でやるからこそ学べるものがたくさんあって、短時間で一気に成長したいなら小さい組織という選択は今すごく納得感がありますね。"
    },
    {
      "type": "h2",
      "text": "就活生へのメッセージ：好きなことを仕事にしよう"
    },
    {
      "type": "p",
      "text": "就活中の方に伝えたいのは、「とにかく好きなことをやろう」ということです。東京の学生と話すと、福利厚生や給料、安定感で会社を見ているという話をよく聞きます。でも、それって好きなことなのでしょうか？仕事外のプライベートを充実させたいという話に聞こえてしまいます。"
    },
    {
      "type": "p",
      "text": "仕事が好きじゃなかったら、幸福度はだいぶ下がると思います。好きなことをやっていれば、おそらく得意になります。好きということ自体が才能だと僕は思っています。その好きを突き詰めたところに仕事があればいいし、なければ作るくらいの勢いで考えています。"
    },
    {
      "type": "h2",
      "text": "1日8時間は長い。だからこそ好きな仕事を"
    },
    {
      "type": "p",
      "text": "1日8時間って長いんですよね。24時間のうち3分の1も取られて、睡眠とか考え始めたら全然時間がない。仕事は人生の大きな要素を占めます。だからこそ、好きなことを仕事にすることが大事だと思います。"
    },
    {
      "type": "p",
      "text": "僕は大学の頃に1年間休学してカナダに行きました。「先の何十年間を、あと1〜2年で決められない」と思ったからです。行って本当に変わりましたね。自分のキャリアに悩んでいる方は、一度立ち止まって「本当に好きなこと」を考えてみてください。コーチングを通じて、その答えを見つけるお手伝いができれば嬉しいです。"
    }
  ],
  "metaDescription": "大企業かスタートアップか悩む就活生へ。インターン経験から大企業を選ばなかった理由と「鶏口牛後」の考え方、好きを仕事にする大切さを解説。",
  "ogpText": "大企業より「小さな組織のトップ」を選んだ理由",
  "ctaType": "find-coach",
  "tags": ["キャリア", "就活", "スタートアップ", "コーチング", "起業", "自己分析"],
  "youtubeUrl": "https://www.youtube.com/watch?v=8pOA8aDMYq8"
}
